{
  "required" : true ,
  "$schema" : "http://json-schema.org/draft-03/schema" ,
  "type" : "object" ,
  "properties" : {
    "href" : {
      "type" : "string" ,
      "required" : false
    } ,
    "username" : {
      "type" : "string" ,
      "required" : false
    } ,
    "email" : {
      "type" : "string" ,
      "required" : false
    } ,
    "fullName" : {
      "type" : "string" ,
      "required" : false
    } ,
    "givenName" : {
      "type" : "string" ,
      "required" : false
    } ,
    "middleName" : {
      "type" : "string" ,
      "required" : false
    } ,
    "surname" : {
      "type" : "string" ,
      "required" : false
    } ,
    "status" : {
      "type" : "string" ,
      "required" : false
    } ,
    "customData" : {
      "type" : "object" ,
      "required" : false ,
      "properties" : {
        "href" : {
          "type" : "string" ,
          "required" : false
        }
      }
    } ,
    "groups" : {
      "type" : "object" ,
      "required" : false ,
      "properties" : {
        "href" : {
          "type" : "string" ,
          "required" : false
        }
      }
    } ,
    "groupMemberships" : {
      "type" : "object" ,
      "required" : false ,
      "properties" : {
        "href" : {
          "type" : "string" ,
          "required" : false
        }
      }
    } ,
    "directory" : {
      "type" : "object" ,
      "required" : false ,
      "properties" : {
        "href" : {
          "type" : "string" ,
          "required" : false
        }
      }
    } ,
    "tenant" : {
      "type" : "object" ,
      "required" : false ,
      "properties" : {
        "href" : {
          "type" : "string" ,
          "required" : false
        }
      }
    } ,
    "emailVerificationToken" : {
      "type" : "object" ,
      "required" : false ,
      "properties" : {
        "href" : {
          "type" : "string" ,
          "required" : false
        }
      }
    }
  }
}